UUID_v4,repo,location,path,translation_needed,type,english,translation,Icelandic,context,key,delim,emoji,formating_exists
fa7a48e5-0b40-4a24-9edb-ef614c645e13,qa-crowdsourcing-app,src/components/organisms/Game/Utils/SpanSelector/index.tsx,qa-crowdsourcing-app/src/components/organisms/Game/Utils/SpanSelector/index.tsx,yes,instruction,Tap the text to choose again,Tap the text to choose again,Smelltu aftur á textann til að velja aftur,Instructions for a user if they want to select a different answer span,[[translation:fa7a48e5-0b40-4a24-9edb-ef614c645e13]],/,No,No
faceb97a-63cc-48e1-9b5b-7917546711b2,qa-crowdsourcing-api,src/models/Users/statics.ts,qa-crowdsourcing-api/src/models/Users/statics.ts,yes,error / text,Passwords need to match,Passwords need to match,Lykilorð verða að vera eins,An error shown to users when registering and the passwords don't match,[[translation:faceb97a-63cc-48e1-9b5b-7917546711b2]],/,No,No
fcf6cdd8-0f87-4fbc-b11c-5ac09432f813,qa-crowdsourcing-app,src/views/ArticleReader/index.tsx,qa-crowdsourcing-app/src/views/ArticleReader/index.tsx,yes,error / text,Unable to fetch article,Unable to fetch article,Ekki tókst að sækja grein,"Sometimes, during the google search stage, there might be an error fetching a specific article",[[translation:fcf6cdd8-0f87-4fbc-b11c-5ac09432f813]],/,No,No
fd1f418f-135f-4b13-b28b-eb6a543cc579,qa-crowdsourcing-app,src/components/organisms/Game/WriteQuestion/index.tsx,qa-crowdsourcing-app/src/components/organisms/Game/WriteQuestion/index.tsx,yes,error / text,Question must end in a question mark (?),Question must end in a question mark (?),Spurningin verður að enda á spurningarmerki,"Error shown to the user if they don't end the question with ""?""",[[translation:fd1f418f-135f-4b13-b28b-eb6a543cc579]],/,No,No
fe71a409-084d-4a8f-99fc-41f721f4a958,qa-crowdsourcing-api,src/routes/api/announcement/interface.ts,qa-crowdsourcing-api/src/routes/api/announcements/interface.ts,yes,text,May,May,maí,The month,[[translation:fe71a409-084d-4a8f-99fc-41f721f4a958]],/,No,No
feda1bfa-88a7-45bc-bd13-993a95e36c02,qa-crowdsourcing-app,,,yes,title,Community Impact,Community Impact,Leiðin að 100 þúsund,The title accompanying the linechart showing the number of questions gathered over time.,[[translation:feda1bfa-88a7-45bc-bd13-993a95e36c02]],,No,No
ffa22022-0151-47c4-bc9c-4645eef5af50,qa-crowdsourcing-app,src/routing/routes.ts,qa-crowdsourcing-app/src/routing/routes.ts,yes,title,Hiscores,Hiscores,Stigatafla,Single word (preferably) that is used as a tab in the bottom navigator to access the hiscores,[[translation:ffa22022-0151-47c4-bc9c-4645eef5af50]],/,No,No
ffa3d402-e5bd-45af-a075-499958d9feef,qa-crowdsourcing-api,src/routes/api/announcement/interface.ts,qa-crowdsourcing-api/src/routes/api/announcements/interface.ts,yes,text,April,April,apríl,The month,[[translation:ffa3d402-e5bd-45af-a075-499958d9feef]],/,No,No